{
  "$schema": "http://json-schema.org/draft-07/schema#",
  "$id": "https://machine_max.io/schemas/base/material_attr.json",
  "title": "Material Attributes",
  "description": "Defines the physical properties of materials, including friction coefficients, elasticity, damage modifiers, and sound effects.",
  "type": "object",
  "properties": {
    "$schema": {
      "type": "string",
      "description": "JSON Schema reference path, used for editor intelligent suggestions and validation",
      "default": "../docs/zh_cn/schemas/base/material_attr.schema.json"
    },
    "friction": {
      "$ref": "vector_3d.schema.json",
      "default": [0.5, 0.5, 0.5],
      "description": "Friction coefficient vector, format [x, y, z]. x is lateral friction coefficient, y is forward friction coefficient, z has no practical meaning."
    },
    "slip_adaptation": {
      "type": "number",
      "minimum": 0.0,
      "maximum": 1.0,
      "default": 0.5,
      "description": "Slip adaptation coefficient, used to adjust friction behavior during sliding."
    },
    "slip_curve": {
      "type": "object",
      "description": "Tire slip friction curve parameters for longitudinal slip ratio and lateral slip angle.",
      "properties": {
        "longitudinal": {
          "type": "object",
          "description": "Longitudinal slip-ratio curve parameters.",
          "properties": {
            "peak_slip_ratio": {
              "type": "number",
              "minimum": 0.0,
              "default": 0.2,
              "description": "Slip ratio at the peak friction scale."
            },
            "base_scale": {
              "type": "number",
              "default": 1.0,
              "description": "Friction scale at zero slip."
            },
            "peak_scale": {
              "type": "number",
              "default": 1.4,
              "description": "Friction scale at peak_slip_ratio."
            },
            "kinetic_scale": {
              "type": "number",
              "default": 0.9,
              "description": "Friction scale in the high-slip kinetic region."
            }
          },
          "additionalProperties": false
        },
        "lateral": {
          "type": "object",
          "description": "Lateral slip-angle curve parameters. All angle fields use degrees.",
          "properties": {
            "peak_angle_deg": {
              "type": "number",
              "minimum": 0.0,
              "default": 12.0,
              "description": "Slip angle (degrees) at peak friction scale."
            },
            "kinetic_angle_deg": {
              "type": "number",
              "minimum": 0.0,
              "default": 90.0,
              "description": "Slip angle (degrees) where kinetic scale is reached."
            },
            "base_scale": {
              "type": "number",
              "default": 1.0,
              "description": "Friction scale at zero slip angle."
            },
            "peak_scale": {
              "type": "number",
              "default": 1.2,
              "description": "Friction scale at peak_angle_deg."
            },
            "kinetic_scale": {
              "type": "number",
              "default": 0.7,
              "description": "Friction scale in the high-angle kinetic region."
            }
          },
          "additionalProperties": false
        }
      },
      "additionalProperties": false
    },
    "rolling_friction": {
      "type": "number",
      "minimum": 0.0,
      "default": 0.2,
      "description": "Rolling friction coefficient."
    },
    "spinning_friction": {
      "type": "number",
      "minimum": 0.0,
      "default": 0.0,
      "description": "Spinning friction coefficient."
    },
    "restitution": {
      "type": "number",
      "minimum": 0.0,
      "maximum": 1.0,
      "default": 0.1,
      "description": "Restitution coefficient (elasticity), 0 for completely inelastic collision, 1 for completely elastic collision."
    },
    "block_damage_factor": {
      "type": "number",
      "minimum": 0.0,
      "default": 1.0,
      "description": "Block damage factor, 0 for unable to break blocks, 1 for full damage, adjust this coefficient to change block breaking capability."
    },
    "rha": {
      "type": "number",
      "minimum": 0.0,
      "default": 1.0,
      "description": "Material relative hardness armor (RHA) penetration resistance coefficient. 0.5 means 50% RHA penetration resistance at same thickness, 1.5 means 1.5 times RHA penetration resistance."
    },
    "angle_effect": {
      "type": "boolean",
      "default": true,
      "description": "Whether equivalent armor thickness is affected by impact angle, if false, thickness calculation ignores impact angle."
    },
    "impact_modifiers": {
      "$ref": "../part/subpart/hit_box/modifier/damage_modifier.schema.json",
      "description": "Impact modifiers, convert received damage into impact values applied to connection points according to certain rules. Default empty list, applies same amount of impact as damage to connection points."
    },
    "penetration_modifiers": {
      "$ref": "../part/subpart/hit_box/modifier/damage_modifier.schema.json",
      "default": [
        {
          "operation": "multiply",
          "value": 0.5,
          "condition": {
            "type": "not",
            "condition": {
              "type": "damage_tag",
              "tag": "machine_max:has_pen_depth"
            }
          }
        }
      ],
      "description": "Penetration modifiers, adjust penetration depth based on received damage. If damage doesn't include penetration data, uses damage value; otherwise uses penetration data. Default uses 0.5 times the damage as penetration when damage doesn't include penetration data."
    },
    "damage_modifiers": {
      "$ref": "../part/subpart/hit_box/modifier/damage_modifier.schema.json",
      "default": [
        {
          "operation": "add",
          "value": -5.0,
          "condition": {
            "type": "damage_type",
            "id": "minecraft:fly_into_wall"
          }
        },
        {
          "operation": "multiply",
          "value": 0.05,
          "condition": {
            "type": "damage_type",
            "id": "minecraft:sweet_berry_bush"
          }
        },
        {
          "operation": "multiply",
          "value": 0.05,
          "condition": {
            "type": "entity_type",
            "id": "minecraft:slime"
          }
        },
        {
          "operation": "multiply",
          "value": 0.1,
          "condition": {
            "type": "entity_type",
            "id": "minecraft:magma_cube"
          }
        }
      ],
      "description": "Damage modifiers, convert received damage into damage values according to certain rules. If damage doesn't include damage data, uses damage value; otherwise uses damage data. Default ignores impact damage below 5, significantly reduces damage from slimes and similar per-frame damage sources."
    },
    "un_penetrate_damage_factor": {
      "type": "number",
      "minimum": 0.0,
      "default": 0.0,
      "description": "Damage factor when attack fails to fully penetrate armor, formula: attack_damage * (penetration / equivalent_armor) ^ un_penetrate_damage_factor, no damage when not fully penetrated if this is 0.0."
    },
    "sounds": {
      "type": "object",
      "properties": {
        "hit_un_pen": {
          "$ref": "sound_event.schema.json",
          "description": "Sound event when hit box is hit but not penetrated.",
          "default": {
            "sound_id": "machine_max:hit_box.hit.up_pen.metal",
            "range": 64
          }
        },
        "hit_pen": {
          "$ref": "sound_event.schema.json",
          "description": "Sound event when hit box is hit and penetrated.",
          "default": {
            "sound_id": "machine_max:hit_box.hit.pen.metal",
            "range": 64
          }
        }
      },
      "additionalProperties": false,
      "description": "Material hit sound configuration."
    }
  },
  "additionalProperties": false,
  "examples": [
    {
      "friction": [0.5, 0.5, 0.5]
    },
    {
      "friction": [0.8, 0.8, 0.8],
      "slip_adaptation": 0.3,
      "slip_curve": {
        "longitudinal": {
          "peak_slip_ratio": 0.18,
          "base_scale": 1.0,
          "peak_scale": 1.5,
          "kinetic_scale": 0.85
        },
        "lateral": {
          "peak_angle_deg": 10.0,
          "kinetic_angle_deg": 75.0,
          "base_scale": 1.0,
          "peak_scale": 1.25,
          "kinetic_scale": 0.65
        }
      },
      "rolling_friction": 0.1,
      "spinning_friction": 0.01,
      "restitution": 0.05,
      "block_damage_factor": 0.5,
      "angle_effect": false,
      "impact_modifiers": [
        {
          "operation": "multiply",
          "value": 0.8,
          "condition": {
            "type": "always"
          }
        }
      ],
      "penetration_modifiers": [
        {
          "operation": "multiply",
          "value": 0.3,
          "condition": {
            "type": "damage_type",
            "id": "minecraft:explosion"
          }
        }
      ],
      "damage_modifiers": [
        {
          "operation": "add",
          "value": -10.0,
          "condition": {
            "type": "damage_type",
            "id": "minecraft:fly_into_wall"
          }
        },
        {
          "operation": "multiply",
          "value": 0.02,
          "condition": {
            "type": "entity_type",
            "id": "minecraft:slime"
          }
        }
      ],
      "un_penetrate_damage_factor": 0.2,
      "sounds": {
        "hit_un_pen": {
          "sound_id": "machine_max:hit_box.hit.up_pen.rubber",
          "range": 48
        },
        "hit_pen": {
          "sound_id": "machine_max:hit_box.hit.pen.rubber",
          "range": 48
        }
      }
    }
  ]
}
