{
  "$schema": "../docs/zh_cn/schemas/base/material_attr.schema.json",
  "friction": [0.35, 0.35, 0.5],
  "slip_adaptation": 0.65,
  "rolling_friction": 0.28,
  "spinning_friction": 0.0,
  "restitution": 0.07,
  "block_damage_factor": 1.3,
  "angle_effect": true,
  "impact_modifiers": [
    {
      "operation": "multiply",
      "value": 0.55,
      "condition": {
        "type": "always"
      }
    }
  ],
  "penetration_modifiers": [
  ],
  "damage_modifiers": [
    {
      "operation": "add",
      "value": -9.0,
      "condition": {
        "type": "damage_type",
        "id": "minecraft:fly_into_wall"
      }
    },
    {
      "operation": "multiply",
      "value": 0.09,
      "condition": {
        "type": "damage_type",
        "id": "minecraft:sweet_berry_bush"
      }
    },
    {
      "operation": "multiply",
      "value": 0.09,
      "condition": {
        "type": "entity_type",
        "id": "minecraft:slime"
      }
    }
  ],
  "un_penetrate_damage_factor": 0.0,
  "sounds": {
    "hit_un_pen": {
      "sound_id": "machine_max:hit_box.hit.up_pen.metal",
      "range": 64
    },
    "hit_pen": {
      "sound_id": "machine_max:hit_box.hit.pen.metal",
      "range": 64
    }
  }
}